{"admission_attempt_id":"00000000-0000-4000-8000-000000000900","checked_at":"2026-10-05T12:00:10.000Z","command":"npm run test:golden","commit_sha":"0123456789abcdef0123456789abcdef01234567","exit_code":0,"golden_minimum":100,"node_version":"v24.15.0","reasons":[],"record_type":"oracle_revision_check","report_sha256":"e377d7930b39c2fc8916c314cc2983e7b6b3f12e167b783ea40caa664b0aca37","result":"passed","rule_coverage":[{"case_ids":["golden-001","golden-002"],"outcome":"fail","rule_id":"BR-RUA-001"},{"case_ids":["golden-003"],"outcome":"pass","rule_id":"BR-RUA-001"},{"case_ids":["golden-004"],"outcome":"indeterminate","rule_id":"INV-RUA-001"},{"case_ids":["golden-005"],"outcome":"not_applicable","rule_id":"settlement"}],"schema_version":1,"test_counts":{"fail":0,"pass":120,"skipped":0,"tests":120,"todo":0},"tree_sha":"89abcdef0123456789abcdef0123456789abcdef","uncovered":[]}
